Q1. Write a SQL statement to insert a record as follows:
Employees :

Enter password: **********
Welcome to the MySQL monitor.  Commands end with ; or \g.
Your MySQL connection id is 9
Server version: 8.0.43 MySQL Community Server - GPL

Copyright (c) 2000, 2025, Oracle and/or its affiliates.

Oracle is a registered trademark of Oracle Corporation and/or its
affiliates. Other names may be trademarks of their respective
owners.

Type 'help;' or '\h' for help. Type '\c' to clear the current input statement.

mysql> use assignments;
Database changed
mysql> create table employees(
    -> employee_id int,
    -> first_name varchar(20),
    -> last_name varchar(20),
    -> email varchar(30),
    -> phone_number bigint,
    -> hire_date date,
    -> job_id varchar(15),
    -> salary decimal(7,2),
    -> commision_pct decimal(3,2),
    -> manager_id int,
    -> department_id int);
Query OK, 0 rows affected (0.04 sec)

mysql> desc employees;
+---------------+--------------+------+-----+---------+-------+
| Field         | Type         | Null | Key | Default | Extra |
+---------------+--------------+------+-----+---------+-------+
| employee_id   | int          | YES  |     | NULL    |       |
| first_name    | varchar(20)  | YES  |     | NULL    |       |
| last_name     | varchar(20)  | YES  |     | NULL    |       |
| email         | varchar(30)  | YES  |     | NULL    |       |
| phone_number  | bigint       | YES  |     | NULL    |       |
| hire_date     | date         | YES  |     | NULL    |       |
| job_id        | varchar(15)  | YES  |     | NULL    |       |
| salary        | decimal(7,2) | YES  |     | NULL    |       |
| commision_pct | decimal(3,2) | YES  |     | NULL    |       |
| manager_id    | int          | YES  |     | NULL    |       |
| department_id | int          | YES  |     | NULL    |       |
+---------------+--------------+------+-----+---------+-------+
11 rows in set (0.01 sec)

mysql> insert into employees values(100, 'Steven', 'King', 'SKING', 5151234567, '1987-06-17', 'AD_PRES', 24000, 0, 200, 10),
    -> (101, 'Neena', 'Kochhar', 'NKOCHHAR', 5151234568, '1987-06-18', 'AD_VP', 17000, 0, 200, 10),
    -> (102, 'Lex', 'De Haan', 'LDEHAAN', 5151234569, '1987-06-19', 'AD_VP', 17000, 0, 200, 10),
    -> (103, 'Alexander', 'Hunold', 'AHUNOLD', 5904234567, '1987-06-20', 'IT_PROG', 9000, 0, 103, 60),
    -> (104, 'Bruce', 'Ernst', 'BERNST', 5904234568, '1987-06-21', 'IT_PROG', 6000, 0, 103, 60),
    -> (105, 'David', 'Austin', 'DAUSTIN', 5904234569, '1987-06-22', 'IT_PROG', 4800, 0, 103, 60),
    -> (106, 'Valli', 'Pataballa', 'VPATABAL', 5904234560, '1987-06-23', 'IT_PROG', 4800, 0, 103, 60),
    -> (107, 'Diana', 'Lorentz', 'DLORENTZ', 5904235567, '1987-06-24', 'IT_PROG', 4200, 0, 114, 30),
    -> (108, 'Nancy', 'Greenberg', 'NGREENBE', 5151244569, '1987-06-25', 'SA_MAN', 12000, 0, 145, 80),
    -> (109, 'Daniel', 'Faviet', 'DFAVIET', 5151244169, '1987-06-26', 'SA_MAN', 9000, 0, 145, 80);
Query OK, 10 rows affected (0.01 sec)
Records: 10  Duplicates: 0  Warnings: 0

mysql> table employees;
+-------------+------------+-----------+----------+--------------+------------+---------+----------+---------------+------------+---------------+
| employee_id | first_name | last_name | email    | phone_number | hire_date  | job_id  | salary   | commision_pct | manager_id | department_id |
+-------------+------------+-----------+----------+--------------+------------+---------+----------+---------------+------------+---------------+
|         100 | Steven     | King      | SKING    |   5151234567 | 1987-06-17 | AD_PRES | 24000.00 |          0.00 |        200 |            10 |
|         101 | Neena      | Kochhar   | NKOCHHAR |   5151234568 | 1987-06-18 | AD_VP   | 17000.00 |          0.00 |        200 |            10 |
|         102 | Lex        | De Haan   | LDEHAAN  |   5151234569 | 1987-06-19 | AD_VP   | 17000.00 |          0.00 |        200 |            10 |
|         103 | Alexander  | Hunold    | AHUNOLD  |   5904234567 | 1987-06-20 | IT_PROG |  9000.00 |          0.00 |        103 |            60 |
|         104 | Bruce      | Ernst     | BERNST   |   5904234568 | 1987-06-21 | IT_PROG |  6000.00 |          0.00 |        103 |            60 |
|         105 | David      | Austin    | DAUSTIN  |   5904234569 | 1987-06-22 | IT_PROG |  4800.00 |          0.00 |        103 |            60 |
|         106 | Valli      | Pataballa | VPATABAL |   5904234560 | 1987-06-23 | IT_PROG |  4800.00 |          0.00 |        103 |            60 |
|         107 | Diana      | Lorentz   | DLORENTZ |   5904235567 | 1987-06-24 | IT_PROG |  4200.00 |          0.00 |        114 |            30 |
|         108 | Nancy      | Greenberg | NGREENBE |   5151244569 | 1987-06-25 | SA_MAN  | 12000.00 |          0.00 |        145 |            80 |
|         109 | Daniel     | Faviet    | DFAVIET  |   5151244169 | 1987-06-26 | SA_MAN  |  9000.00 |          0.00 |        145 |            80 |
+-------------+------------+-----------+----------+--------------+------------+---------+----------+---------------+------------+---------------+
10 rows in set (0.00 sec)

Department :

mysql> create table department(
    -> department_id int,
    -> department_name varchar(30),
    -> manager_id int,
    -> location_id int);
Query OK, 0 rows affected (0.02 sec)

mysql> desc department;
+-----------------+-------------+------+-----+---------+-------+
| Field           | Type        | Null | Key | Default | Extra |
+-----------------+-------------+------+-----+---------+-------+
| department_id   | int         | YES  |     | NULL    |       |
| department_name | varchar(30) | YES  |     | NULL    |       |
| manager_id      | int         | YES  |     | NULL    |       |
| location_id     | int         | YES  |     | NULL    |       |
+-----------------+-------------+------+-----+---------+-------+
4 rows in set (0.00 sec)

mysql> insert into department values(10, 'administration', 200, 1700),
    -> (20, 'marketing', 201, 1800),
    -> (30, 'purchasing', 114, 1700),
    -> (40, 'human resources', 203, 2400),
    -> (50, 'shipping', 121, 1500),
    -> (60, 'it', 103, 1400),
    -> (70, 'public relations', 204, 2700),
    -> (80, 'sales', 145, 2500);
Query OK, 8 rows affected (0.00 sec)
Records: 8  Duplicates: 0  Warnings: 0

mysql> table department;
+---------------+------------------+------------+-------------+
| department_id | department_name  | manager_id | location_id |
+---------------+------------------+------------+-------------+
|            10 | administration   |        200 |        1700 |
|            20 | marketing        |        201 |        1800 |
|            30 | purchasing       |        114 |        1700 |
|            40 | human resources  |        203 |        2400 |
|            50 | shipping         |        121 |        1500 |
|            60 | it               |        103 |        1400 |
|            70 | public relations |        204 |        2700 |
|            80 | sales            |        145 |        2500 |
+---------------+------------------+------------+-------------+
8 rows in set (0.00 sec)


Q2. Write a SQL statement to insert 3 rows by a single insert statement.

mysql> insert into department values(90, 'cs', 250, 1300),
    -> (100, 'banking', 140, 2800),
    -> (110, 'networking', 120, 2200);
Query OK, 3 rows affected (0.00 sec)
Records: 3  Duplicates: 0  Warnings: 0

mysql> table department;
+---------------+------------------+------------+-------------+
| department_id | department_name  | manager_id | location_id |
+---------------+------------------+------------+-------------+
|            10 | administration   |        200 |        1700 |
|            20 | marketing        |        201 |        1800 |
|            30 | purchasing       |        114 |        1700 |
|            40 | human resources  |        203 |        2400 |
|            50 | shipping         |        121 |        1500 |
|            60 | it               |        103 |        1400 |
|            70 | public relations |        204 |        2700 |
|            80 | sales            |        145 |        2500 |
|            90 | cs               |        250 |        1300 |
|           100 | banking          |        140 |        2800 |
|           110 | networking       |        120 |        2200 |
+---------------+------------------+------------+-------------+
11 rows in set (0.00 sec)


Q3. Write a SQL statement to insert one row in jobs table to ensure that no duplicate value will be entered in the job_id column.

mysql> create table jobs(
    -> job_id varchar(15) primary key,
    -> job_title varchar(50),
    -> min_salary int,
    -> max_salary int);
Query OK, 0 rows affected (0.02 sec)

mysql> desc jobs;
+------------+-------------+------+-----+---------+-------+
| Field      | Type        | Null | Key | Default | Extra |
+------------+-------------+------+-----+---------+-------+
| job_id     | varchar(15) | NO   | PRI | NULL    |       |
| job_title  | varchar(50) | YES  |     | NULL    |       |
| min_salary | int         | YES  |     | NULL    |       |
| max_salary | int         | YES  |     | NULL    |       |
+------------+-------------+------+-----+---------+-------+
4 rows in set (0.00 sec)

mysql> insert into jobs (job_id, job_title, min_salary, max_salary)
    -> values
    -> ('ad_pres', 'president', 20000, 40000),
    -> ('ad_vp', 'administration vice president', 15000, 30000),
    -> ('ad_asst', 'administration assistant', 3000, 6000),
    -> ('fi_mgr', 'finance manager', 8200, 16000),
    -> ('fi_account', 'accountant', 4200, 9000),
    -> ('ac_mgr', 'accounting manager', 8200, 16000),
    -> ('ac_account', 'public accountant', 4200, 9000),
    -> ('sa_man', 'sales manager', 10000, 20000);
Query OK, 8 rows affected (0.01 sec)
Records: 8  Duplicates: 0  Warnings: 0

mysql> table jobs;
+------------+-------------------------------+------------+------------+
| job_id     | job_title                     | min_salary | max_salary |
+------------+-------------------------------+------------+------------+
| ac_account | public accountant             |       4200 |       9000 |
| ac_mgr     | accounting manager            |       8200 |      16000 |
| ad_asst    | administration assistant      |       3000 |       6000 |
| ad_pres    | president                     |      20000 |      40000 |
| ad_vp      | administration vice president |      15000 |      30000 |
| fi_account | accountant                    |       4200 |       9000 |
| fi_mgr     | finance manager               |       8200 |      16000 |
| sa_man     | sales manager                 |      10000 |      20000 |
+------------+-------------------------------+------------+------------+
8 rows in set (0.00 sec)


Q4. Write SQL statement to increment salary of each emp by 10%.

mysql> update employees set salary = salary * 1.10;
Query OK, 10 rows affected (0.00 sec)
Rows matched: 10  Changed: 10  Warnings: 0

mysql> table employees;
+-------------+------------+-----------+----------+--------------+------------+---------+----------+---------------+------------+---------------+
| employee_id | first_name | last_name | email    | phone_number | hire_date  | job_id  | salary   | commision_pct | manager_id | department_id |
+-------------+------------+-----------+----------+--------------+------------+---------+----------+---------------+------------+---------------+
|         100 | Steven     | King      | SKING    |   5151234567 | 1987-06-17 | AD_PRES | 26400.00 |          0.00 |        200 |            10 |
|         101 | Neena      | Kochhar   | NKOCHHAR |   5151234568 | 1987-06-18 | AD_VP   | 18700.00 |          0.00 |        200 |            10 |
|         102 | Lex        | De Haan   | LDEHAAN  |   5151234569 | 1987-06-19 | AD_VP   | 18700.00 |          0.00 |        200 |            10 |
|         103 | Alexander  | Hunold    | AHUNOLD  |   5904234567 | 1987-06-20 | IT_PROG |  9900.00 |          0.00 |        103 |            60 |
|         104 | Bruce      | Ernst     | BERNST   |   5904234568 | 1987-06-21 | IT_PROG |  6600.00 |          0.00 |        103 |            60 |
|         105 | David      | Austin    | DAUSTIN  |   5904234569 | 1987-06-22 | IT_PROG |  5280.00 |          0.00 |        103 |            60 |
|         106 | Valli      | Pataballa | VPATABAL |   5904234560 | 1987-06-23 | IT_PROG |  5280.00 |          0.00 |        103 |            60 |
|         107 | Diana      | Lorentz   | DLORENTZ |   5904235567 | 1987-06-24 | IT_PROG |  4620.00 |          0.00 |        114 |            30 |
|         108 | Nancy      | Greenberg | NGREENBE |   5151244569 | 1987-06-25 | SA_MAN  | 13200.00 |          0.00 |        145 |            80 |
|         109 | Daniel     | Faviet    | DFAVIET  |   5151244169 | 1987-06-26 | SA_MAN  |  9900.00 |          0.00 |        145 |            80 |
+-------------+------------+-----------+----------+--------------+------------+---------+----------+---------------+------------+---------------+
10 rows in set (0.00 sec)


Q5. Write a SQL statement to change the email column of employees table with 'not available' for those employees whose department_id is 80 and gets a commission is less than .20%

mysql> update employees set email='not available'  where department_id=80 and commision_pct < 0.20;
Query OK, 2 rows affected (0.00 sec)
Rows matched: 2  Changed: 2  Warnings: 0

mysql> table employees;
+-------------+------------+-----------+---------------+--------------+------------+---------+----------+---------------+------------+---------------+
| employee_id | first_name | last_name | email         | phone_number | hire_date  | job_id  | salary   | commision_pct | manager_id | department_id |
+-------------+------------+-----------+---------------+--------------+------------+---------+----------+---------------+------------+---------------+
|         100 | Steven     | King      | SKING         |   5151234567 | 1987-06-17 | AD_PRES | 26400.00 |          0.00 |        200 |            10 |
|         101 | Neena      | Kochhar   | NKOCHHAR      |   5151234568 | 1987-06-18 | AD_VP   | 18700.00 |          0.00 |        200 |            10 |
|         102 | Lex        | De Haan   | LDEHAAN       |   5151234569 | 1987-06-19 | AD_VP   | 18700.00 |          0.00 |        200 |            10 |
|         103 | Alexander  | Hunold    | AHUNOLD       |   5904234567 | 1987-06-20 | IT_PROG |  9900.00 |          0.00 |        103 |            60 |
|         104 | Bruce      | Ernst     | BERNST        |   5904234568 | 1987-06-21 | IT_PROG |  6600.00 |          0.00 |        103 |            60 |
|         105 | David      | Austin    | DAUSTIN       |   5904234569 | 1987-06-22 | IT_PROG |  5280.00 |          0.00 |        103 |            60 |
|         106 | Valli      | Pataballa | VPATABAL      |   5904234560 | 1987-06-23 | IT_PROG |  5280.00 |          0.00 |        103 |            60 |
|         107 | Diana      | Lorentz   | DLORENTZ      |   5904235567 | 1987-06-24 | IT_PROG |  4620.00 |          0.00 |        114 |            30 |
|         108 | Nancy      | Greenberg | not available |   5151244569 | 1987-06-25 | SA_MAN  | 13200.00 |          0.00 |        145 |            80 |
|         109 | Daniel     | Faviet    | not available |   5151244169 | 1987-06-26 | SA_MAN  |  9900.00 |          0.00 |        145 |            80 |
+-------------+------------+-----------+---------------+--------------+------------+---------+----------+---------------+------------+---------------+
10 rows in set (0.00 sec)


Q6. Write a SQL statement to change the email column of employees table with 'not available' for those employees who belongs to the 'Purchasing' department.

mysql> update employees set email='not available' where department_id = 30;
Query OK, 1 row affected (0.00 sec)
Rows matched: 1  Changed: 1  Warnings: 0

mysql> table employees;
+-------------+------------+-----------+---------------+--------------+------------+---------+----------+---------------+------------+---------------+
| employee_id | first_name | last_name | email         | phone_number | hire_date  | job_id  | salary   | commision_pct | manager_id | department_id |
+-------------+------------+-----------+---------------+--------------+------------+---------+----------+---------------+------------+---------------+
|         100 | Steven     | King      | SKING         |   5151234567 | 1987-06-17 | AD_PRES | 26400.00 |          0.00 |        200 |            10 |
|         101 | Neena      | Kochhar   | NKOCHHAR      |   5151234568 | 1987-06-18 | AD_VP   | 18700.00 |          0.00 |        200 |            10 |
|         102 | Lex        | De Haan   | LDEHAAN       |   5151234569 | 1987-06-19 | AD_VP   | 18700.00 |          0.00 |        200 |            10 |
|         103 | Alexander  | Hunold    | AHUNOLD       |   5904234567 | 1987-06-20 | IT_PROG |  9900.00 |          0.00 |        103 |            60 |
|         104 | Bruce      | Ernst     | BERNST        |   5904234568 | 1987-06-21 | IT_PROG |  6600.00 |          0.00 |        103 |            60 |
|         105 | David      | Austin    | DAUSTIN       |   5904234569 | 1987-06-22 | IT_PROG |  5280.00 |          0.00 |        103 |            60 |
|         106 | Valli      | Pataballa | VPATABAL      |   5904234560 | 1987-06-23 | IT_PROG |  5280.00 |          0.00 |        103 |            60 |
|         107 | Diana      | Lorentz   | not available |   5904235567 | 1987-06-24 | IT_PROG |  4620.00 |          0.00 |        114 |            30 |
|         108 | Nancy      | Greenberg | not available |   5151244569 | 1987-06-25 | SA_MAN  | 13200.00 |          0.00 |        145 |            80 |
|         109 | Daniel     | Faviet    | not available |   5151244169 | 1987-06-26 | SA_MAN  |  9900.00 |          0.00 |        145 |            80 |
+-------------+------------+-----------+---------------+--------------+------------+---------+----------+---------------+------------+---------------+
10 rows in set (0.00 sec)


Q7. Write a SQL statement to change the email and commission_pct column of employees table with 'not available' and 0.10 for all employees.


mysql> update employees set email='not available' and commision_pct = 0.10;
ERROR 1292 (22007): Truncated incorrect DOUBLE value: 'not available'
mysql> update employees set email='not available';
Query OK, 7 rows affected (0.00 sec)
Rows matched: 10  Changed: 7  Warnings: 0

mysql> update employees set commision_pct = 0.10;
Query OK, 10 rows affected (0.00 sec)
Rows matched: 10  Changed: 10  Warnings: 0

mysql> table employees;
+-------------+------------+-----------+---------------+--------------+------------+---------+----------+---------------+------------+---------------+
| employee_id | first_name | last_name | email         | phone_number | hire_date  | job_id  | salary   | commision_pct | manager_id | department_id |
+-------------+------------+-----------+---------------+--------------+------------+---------+----------+---------------+------------+---------------+
|         100 | Steven     | King      | not available |   5151234567 | 1987-06-17 | AD_PRES | 26400.00 |          0.10 |        200 |            10 |
|         101 | Neena      | Kochhar   | not available |   5151234568 | 1987-06-18 | AD_VP   | 18700.00 |          0.10 |        200 |            10 |
|         102 | Lex        | De Haan   | not available |   5151234569 | 1987-06-19 | AD_VP   | 18700.00 |          0.10 |        200 |            10 |
|         103 | Alexander  | Hunold    | not available |   5904234567 | 1987-06-20 | IT_PROG |  9900.00 |          0.10 |        103 |            60 |
|         104 | Bruce      | Ernst     | not available |   5904234568 | 1987-06-21 | IT_PROG |  6600.00 |          0.10 |        103 |            60 |
|         105 | David      | Austin    | not available |   5904234569 | 1987-06-22 | IT_PROG |  5280.00 |          0.10 |        103 |            60 |
|         106 | Valli      | Pataballa | not available |   5904234560 | 1987-06-23 | IT_PROG |  5280.00 |          0.10 |        103 |            60 |
|         107 | Diana      | Lorentz   | not available |   5904235567 | 1987-06-24 | IT_PROG |  4620.00 |          0.10 |        114 |            30 |
|         108 | Nancy      | Greenberg | not available |   5151244569 | 1987-06-25 | SA_MAN  | 13200.00 |          0.10 |        145 |            80 |
|         109 | Daniel     | Faviet    | not available |   5151244169 | 1987-06-26 | SA_MAN  |  9900.00 |          0.10 |        145 |            80 |
+-------------+------------+-----------+---------------+--------------+------------+---------+----------+---------------+------------+---------------+
10 rows in set (0.00 sec)





